"Although Mike's girlfriend may be upset he bought an SUV from the other car dealer as opposed to going to her uncle's dealer, he will have saved money in the long-run. He will not have had to jeopardize his education for a new car.",3.3159783,3.260088,3.1750312,3.0299125,2.6190844,1.8631961,1.2368734,0.8574446,0.65432525,0.5091327,0.44018233,-0.406933637
"Mike could convince his girlfriend to go with an SUV that would be cheaper than buying from her uncle, that way he could both afford the SUV and the car that he loves.",3.2388089,3.1456387,3.0038443,2.7619257,2.1805537,1.2130492,0.51994723,0.29025516,0.19840539,0.13752064,0.121296786,-0.757050871
"Start looking for a job that pays well and is flexible with student hours (server, delivery driver, etc.). Schedule things around so that you can work as many hours as possible but still have ample time for studying. Setting aside specific study time is iportant. Start earning and saving money from the new job while also continuing your education. Then, sometime before winter snow hits, buy a vehicle from the uncle that will be dependable using the extra money you've saved from work. At this point, you ca cut back the hours if needed or just adjust to maintain your well-being. I think everyone wins with this plan. It requires some extra upfront work but the end result will be better than settling on something easier/simpler.",1.5818875,1.6579343,1.7736689,1.9711273,2.3000193,3.038507,4.0,4.0,3.8249493,3.5402405,3.3712533,1.273884762
Mike could use public transportation during the winter months.,2.070663,2.0840218,2.1043522,2.1390386,2.1391973,2.2921243,2.7248561,2.6964138,2.5784676,2.3865733,2.2795715,-0.015974596
"Keep your dream car, wait out the winter!",2.4137418,2.437131,2.472727,2.5334578,2.5576384,2.6477997,2.8814745,2.6667225,2.4510965,2.211009,2.0759203,-0.668994604
Explain to the girlfriend that quality is not as important as price due to education and income at this time.,1.2823015,1.2072109,1.0929322,0.8979566,0.5345534,0.4102101,1.0920539,1.693078,1.9663354,2.0223649,2.0665627,-0.605599485
Mike can start looking for another apartment closer to school and or an apartment that is not located on such a steep hill. If he moves he can keep the car that he loves and not put his education in danger by getting another job to pay for a new vehicle.,3.0508344,3.0672653,3.0922697,3.1349325,3.0830824,2.891779,2.6743207,2.192363,1.8605818,1.584672,1.4313287,0.485594025
"Mike should either save up to buy a used car or try another form of transportation, such as a public transit.",3.1275403,3.1086009,3.0797765,3.0306005,2.806777,2.3590212,1.9772614,1.5694484,1.3117237,1.1039369,0.9941523,-0.015974596
"Mike should go with his girlfriend's uncle's SUV because he can trust the quality of the vehicle, or he should move",3.3144312,3.2439725,3.1367435,2.9537976,2.4743826,1.6251745,0.9534913,0.6196171,0.4539665,0.33945528,0.2898758,-0.318877369
Mark should let his girlfriend know about his money situation and make her understand he can't afford to pay too much for a car when he has the opportunity to pay less.,2.0190728,1.9457067,1.8340522,1.6435559,1.2383033,0.8514436,1.0426953,1.3046223,1.418634,1.412737,1.4228752,-0.757050871
Mike should ask his girlfriend if she can take him to school for a little while longer until he can find a new place to live where he an utilize the vehicle he already has.,3.016419,2.9669242,2.8915994,2.7630854,2.4027312,1.7993159,1.3950593,1.1316566,0.975191,0.84029114,0.77578586,0.119296133
Mike should sell his car for his girlfriends uncle's car so he knows he is getting a more reliable form of transportation.,3.2010624,3.1253333,3.0100832,2.8134513,2.316876,1.4758031,0.8636665,0.5973792,0.46899337,0.3745099,0.3368038,-0.605599485
"I think that Mike should buy a really cheap car, from the girlfriends uncle's shop, but also keep the car he has. He can also probably get a loan from the bank that way he doesn't have to jeopardie his education.",3.7926717,3.7724037,3.7415586,3.6889336,3.4137247,2.7103834,1.8765439,1.171488,0.7773589,0.519719,0.38300988,0.772316141
I thin to resolve Mike's problm he should worry about his needs right now. I think he should take the offer from the other car dealer and buy a truck from him instead of his girlfriends uncle. It's a tough situation but nobody supports him financially buthim and if that's the best choice for him right now than he should go for that.,3.4542181,3.4114332,3.3463182,3.2352254,2.8768065,2.1540368,1.4763678,0.9939685,0.7283838,0.5447634,0.4524871,-0.605599485
Mike needs to move!!!,1.7209485,1.6896236,1.6419518,1.5606176,1.3738163,1.3686383,1.8945253,2.1620843,2.231563,2.1610732,2.128361,-0.517543217
I think Mike should go check out both of the cars and compare them for example what will be better in the long run also research the vehicles.,3.080462,3.037406,2.971879,2.8600826,2.5257401,1.9400362,1.5131626,1.2009245,1.0145837,0.86111,0.78531206,-0.757050871
"Save enough money and buy a new car, the girl friend needs to be patient with him.",2.1210358,2.024885,1.8785545,1.6288966,1.1092957,0.53771675,0.58774406,0.87362576,1.0242997,1.0581279,1.0940595,-0.757050871
Mark should trade his car in for an SUV from the cheaper car dealership and not worry about offending his girlfriend or her uncle.,2.5852396,2.4841354,2.3302662,2.0677452,1.4932994,0.71738994,0.43908185,0.5299098,0.59565187,0.60313255,0.62560886,-0.757050871
Mike can talk to his girlfriend's uncle and tell him he found it cheaper and ask him if he is willing to price match.,1.7234805,1.6270381,1.4802657,1.2298516,0.73584926,0.31004322,0.6268265,1.0937134,1.3286844,1.3945854,1.448048,-0.167425983
Find a different apartment that is not located on a steep hill.,0.8694336,0.85649663,0.83680785,0.8032167,0.7608778,1.1904565,2.3482506,2.9449718,3.1465352,3.1048636,3.0845106,0.485594025
Mike could save his money and buy better tires that would give him more traction.,2.702525,2.650027,2.5701325,2.4338222,2.080604,1.5744135,1.3719466,1.2599949,1.1771566,1.0733973,1.0264078,0.725101679
Mike could talk to his girlfriend's uncle and tell him that another dealer has the same car for a lower price and he was wondering if he would sell mike the car for the same price. Maybe that way he could keep his dream car and only drive to SUV in the witer.,3.2894623,3.2305157,3.140808,2.987754,2.5643134,1.7985775,1.1803727,0.8223669,0.6326126,0.49592882,0.43217167,0.182691252
"mike should sell his car, get the cheap SUV that way he has extra money, he gets up the hill and his not jeopardizing his education",3.8364935,3.8243494,3.8058677,3.7743354,3.534459,2.8672018,2.02973,1.27981,0.8557582,0.5776105,0.42824653,-0.757050871
"I think Mike should go in for his girlfriend's Uncle's deal since he will assure the quality of the vehicle. And also because Mike earns very small income, he would not want to get a car which will give him problems.",3.4577694,3.4257295,3.3769696,3.293779,2.9857862,2.3309577,1.6851246,1.1680322,0.87430346,0.66786,0.561192,-0.605599485
"One solution could be that he negotiates with his girlfriends uncle to get the SUV for a more cost effective price beause he is a college student that needs a safe way to and from work/school. This way he pleases his girlfriend and her uncle, while also bing able to keep his sports car and not acquire a second job.",3.1030054,3.0638523,3.004266,2.9026039,2.5851364,2.0162156,1.5865966,1.2521284,1.0510975,0.8876526,0.80571,0.334142639
I think mike should put winter tires on his sports car that gives him enough traction to make it up the hill,3.2211602,3.2812352,3.3726628,3.528649,3.671032,3.6977665,3.5046287,2.81114,2.3322835,1.9513446,1.7328238,0.725101679
"If I was Mike id suggest that he just get the cheaper car, because he does not need to jeopardize school because of car expenses. Also he should explain to his girlfriend that he got a better deal so it has nothing to do with her uncle just its finacncialy better for him if he gets the cheap one.",3.5704725,3.5240784,3.4534721,3.3330088,2.9496903,2.1604872,1.3930486,0.8690907,0.5882729,0.4030214,0.31051293,-0.25548225
Mike could gather whatever money he has and save up until he has enough money for the SUV and ask his girlfriend to support him for a while longer. He can also ask his girlfriend if her uncle would ever be able to reconsider the price of the SUV he is seling.,3.2542088,3.1771674,3.05992,2.8598793,2.3535104,1.4842403,0.83213776,0.54581344,0.40960515,0.31366852,0.27540937,0.334142639
"Explain to Mike's girlfriend that he can't afford a new car, and that instead of buying one or having her continue to drive him around, he is making a commitment to walking on snow days.",3.6226976,3.59784,3.5600119,3.495471,3.2101574,2.5403662,1.8063611,1.1924357,0.8457306,0.6111689,0.48787045,0.135476791
"Mike should sell his car, even though it's his dream car, it's not really doing him any favors in the winter time and he should buy an SUV from his uncle because it will be better quality and probably be able to withstand all the snow and the steep hills ike has to deal with.",4.0,4.0,4.0,4.0,3.80629,3.156576,2.2476919,1.3863077,0.8969293,0.580368,0.40786132,-0.605599485
"Mike needs to look at both of the vehilces from the different sellers and make a financially based decision. If the higher quality vehicle is not overpriced then he should purchase that vehicle because it will save him money in the long wrong, but if the ther vehicle is in a decent condition and lower price he should choose that one because it will save him money.",2.0508463,1.9908174,1.8994606,1.7435938,1.3990713,1.086369,1.2987039,1.505177,1.5785059,1.5421188,1.533214,0.334142639
"Negotiate with the Uncle by bringing up the prices of the other cheaper SUV's to see if he can lower the price of the suggested SUV- if not, then buy from the cheaper dealer.",2.315328,2.248299,2.1462896,1.9722486,1.5767801,1.1207362,1.1326957,1.2408978,1.2764863,1.233851,1.2228152,-0.015974596
In the winter Mike can take local or pubic transportation until he can afford an SUV for the winter.,3.4331305,3.480869,3.5535197,3.6774733,3.7473054,3.6157997,3.2406461,2.4891086,1.9971563,1.6253202,1.4140058,-0.167425983
If mike is not willing to part ways with his vehicle he could finish out the semester catching the city bus and asking his girlfriend for rides only when neccessary. Look into trading out car for something that comes in at a close second and is reliable fr bad weather conditions. and continue his school work and not focus on getting an extra job to pay for something that has an alternative paths,3.6593268,3.6948726,3.7489681,3.8412633,3.8382642,3.5441704,2.97788,2.1614017,1.6529956,1.2888337,1.0839194,0.987162646
"Mike could either decide to buy a cheap used car to get him through until he could buy a better car, or Mike could even decide to take public transportation, regardless of if it's not the most ""ideal"" situation.",2.9987698,2.9631724,2.9089973,2.8165689,2.522938,2.015647,1.6675361,1.3693446,1.1811552,1.0185012,0.9363422,-0.015974596
"A possible solution to Mike's problem is public transportation. Taking a bus, taxi, or subway, etc might be a good alternative during bad weather.",2.605368,2.653065,2.7256553,2.8495018,2.9752953,3.150954,3.333024,2.956621,2.6387446,2.3325036,2.1569412,-0.167425983
Sell the car and ask her uncle to bring the price down.,2.120662,2.0637364,1.9771013,1.8292925,1.4946648,1.1760325,1.3512427,1.5165328,1.5672765,1.5188551,1.5028279,-1.107168106
Ask Mike's girlfriend's uncle if he can match the price of the other vehicles.,3.0315473,2.9597845,2.850572,2.664239,2.197865,1.4453146,0.95995086,0.7582486,0.65537715,0.5659889,0.5303372,-0.454148098
Keep researching around the area and come up with the best price. Ask her uncle if he will match the price if he finds a lower deal somewhere else but if not buy it from the cheaper dealership and try to stay in school.,2.220252,2.1602302,2.0688846,1.9130377,1.5570579,1.1814866,1.2797798,1.409483,1.4471885,1.397379,1.3811588,-0.454148098
"Choose a car that he can afford and that will get him through the winter season, and if his girlfriend breaks up with him because of it, she wasn't the one for him.",2.5395014,2.4915044,2.41846,2.2938354,1.972898,1.5562639,1.4778978,1.4259454,1.3658954,1.265596,1.219674,-0.757050871
"MIke should explain to his girlfriend that he cannot afford the price of her uncles car. However, he is very interested in purchasing one from him. Mike should see if his girlfriend can talk her unlce into price-matching the vehice so that he can get a reiable car at a pricepoint he can afford.",3.6083968,3.5526953,3.4679258,3.3232975,2.8935223,2.0302515,1.2076344,0.6951484,0.4300893,0.261358,0.17954668,-0.406933637
"Mike could talk to his girlfriend about the situation, and he could talk to other friends if they can give him rides if his girlfriend doesnt want to give him rides anymore. If a dealer has cheaper car then he should buy it cheaper as long as someone who nows about cars problems can check if evething is okay with the car such as a friend.",3.3907645,3.3133023,3.1954126,2.9942794,2.476662,1.5539606,0.8085704,0.46167803,0.2978432,0.1919832,0.14839274,0.684259873
Walk to school or take a bus,1.1080699,1.1052114,1.1008613,1.0934397,1.0824329,1.4883434,2.517558,2.9751382,3.1008487,3.0191512,2.975152,-0.015974596
"Decrease social activities to allow for a second job. This will supply the money needed to compensate the girlfriend for the gas she is using on your transportation. Later on, there will be enough money saved up that you can then sell your current car, tak down the price of the SUV for the Uncle AND the other dealer, and afford the car.",2.5005429,2.4769266,2.4409845,2.3796637,2.1763213,1.9312844,1.956801,1.8474413,1.7334195,1.5850636,1.5085169,0.923767527
"Buy the cheaper car, but ask his girlfriend's uncle to take a look at it before purchasing it, explain his financial situation to her uncle.",2.7724092,2.6782832,2.5350344,2.2906342,1.7363933,0.9359488,0.55383885,0.5383887,0.54699934,0.5250307,0.5301876,-0.318877369
Mike can keep his dream car and still get to school by parking his car at the bottom of the hill when it's snowy or going to snow.,3.5461507,3.6067898,3.6990745,3.8565252,3.9795191,3.889185,3.47902,2.6365635,2.087965,1.6801234,1.4468403,-0.015974596
Mike should sell his old car and get a new SUV from his girlfriend's uncle to assure the quality of the vehicle.,3.0459783,2.9515965,2.8079588,2.562895,1.9888915,1.0851964,0.51807237,0.37947083,0.33123705,0.288154,0.2818514,-0.757050871
Buy the SUV from girl friend's uncle.,2.304597,2.2141056,2.07639,1.8414278,1.3360636,0.7327894,0.6772469,0.862543,0.960207,0.96763515,0.98815066,-1.107168106
I would suck it up and sell my car and get a new SUV while taking more online classes and working more so I could afford it.,2.6918414,2.6546268,2.5979924,2.5013647,2.2209308,1.8172117,1.670615,1.5164505,1.3968918,1.2619193,1.1951399,0.27074752
"I would go buy the cheapest suv with my gf uncle. I would use the suv during the winter and not have to bother anyone for a ride anymore, however if i want to keep my sports car i will have to get a parttime job to help with the payments and gas. Being a uv it will take and waste more gas then my car.",3.0718105,3.0704174,3.068298,3.0646813,2.927372,2.6134052,2.3250563,1.8884687,1.5977209,1.3575375,1.2269063,0.031239866
"I would let him keep the car and assist him buying a new vehicle , I understand how hard it would be to sell something that has a lot sentimental value.  But its also important for his to become more independent. Keeping the car in the summer, but  the on that i will help him buy i would mostly use except when it gets really bad in the neighborhood with the snow.",2.7922225,2.8119476,2.8419666,2.893184,2.8744113,2.8003888,2.7675514,2.3926146,2.1067848,1.8444316,1.697876,-0.25548225
Mike could ask his girlfriend's uncle to buy the SUV from the the other dealership and sell it to him at that price or even lower as well as assure the quality of the vehicle.,3.3137927,3.2376034,3.1216521,2.9238238,2.417429,1.5315211,0.84201473,0.52607304,0.37516886,0.27273083,0.23077251,0.573650293
"Make a decision with the significant other about how much of an inconvenience driving you around really is, determine if they understand how much the sports car means to you and your financial state, consider how much that significant other means to you ad your future/happiness, and determine whether the uncle will match the other dealer's price; then, if you must get a new car, choose the dealer that makes the most sense as a result of those prior determinations.",2.1110766,2.0449626,1.9443456,1.7726804,1.3953806,1.0210928,1.1734941,1.3714123,1.4475969,1.4192061,1.4157668,0.3813571
"Sell some old items in the house, haggle the Uncle to a cheaper price, and buy the SUV. If that fails, walk.",1.9039886,1.8420609,1.747814,1.5870163,1.2435019,0.9731028,1.2782727,1.5571243,1.6661605,1.645379,1.6453241,0.573650293
I would tell mike to buy the car from the dealership since it is cheaper since money is already an issue.,2.9311981,2.8749833,2.78943,2.6434665,2.2572057,1.6421263,1.2738469,1.0697433,0.948323,0.8342644,0.78233963,-0.757050871
"Mike should tell his girlfriend's uncle that he found the same car cheaper in another dealer, and ask him if he could match the price.",2.6187932,2.500516,2.320511,2.013401,1.3557066,0.45665395,0.101057194,0.22955519,0.33202878,0.37287715,0.4166613,-0.757050871
Mike should get the SUV from his girlfriends uncle because he is then more likely to help Mike out financially.,2.980794,2.908534,2.7985642,2.6109402,2.1456647,1.4087595,0.95598376,0.77880573,0.6878701,0.6035414,0.5707373,-0.757050871
Mike should keep his dream car and his girlfriend should stop being lame and drive her boyfriend around.,2.4797788,2.4011106,2.281388,2.0771246,1.6156225,1.0234873,0.8876477,0.95717895,0.9878812,0.9566451,0.9539394,0.119296133
"Mike should keep his dream car in my opinion. He may never come across it again. As far as where he should get it, I think he would be better off getting it from his girlfriend's uncle depending on how much cheaper it is. It pays off more in the long run o have something reliable as opposed to being unsure and the car breaking down.",3.0653214,3.0145285,2.9372287,2.8053427,2.4355512,1.8056071,1.3642883,1.0827272,0.9192933,0.7832463,0.71835244,0.182691252
Mike should buy a used SUV that he can afford to pay cash for. The quality doesn't need to be amazing as he only needs it for the snow,3.4933612,3.4838161,3.4692914,3.4445083,3.240166,2.7171004,2.1189477,1.5164777,1.1579149,0.90146905,0.7634589,-0.302696712
Mike should just go with the suv and wait to get money with his degree to get his dream car.,3.2961535,3.2499752,3.179698,3.059795,2.6961007,2.0101697,1.4281232,1.0277785,0.8040659,0.64007074,0.5591071,-0.318877369
Buy the SUV from the girlfriend's uncle because he provides assured quality so he won't have to worry about future problems with the car.,2.5789406,2.49873,2.3766592,2.168389,1.6928846,1.0539778,0.8464563,0.8758133,0.88960725,0.85376054,0.8488226,-0.757050871
Mike trades in his car and gets a reliable vehicle for winter months.,2.8295624,2.8194811,2.8041387,2.7779622,2.6161175,2.3361223,2.1832132,1.8831223,1.6654401,1.4626544,1.3539827,-0.605599485
Mike needs to check to see how much taking a taxi or urber would cost him in a months time because this may be cheaper than buying a SUV from just the winter months.,2.610732,2.5574198,2.476284,2.337857,1.9870209,1.509669,1.3664119,1.298555,1.237088,1.1423028,1.1003523,0.772316141
"I would try to sell, or perhaps trade in the sports car to the local dealer in order to get a better deal. I appreciate what my girlfriends uncle is trying to do for me, but the dealer is a better fit with my current financial situation.",3.152887,3.1551006,3.1584694,3.164217,3.0384092,2.7175746,2.3861198,1.9016999,1.5847169,1.3305533,1.1916465,0.334142639
Trully if I was Mike I would sell my dream car which is useless to me most of the time. I would then buy the cheaper version since I am a college student and with not enough income I cant afford the luxury of buying the same car for a higher price. I woul explain that to the uncle of my girlfriend and hopefuly he can see my point of view.,3.0333934,3.0031173,2.9570403,2.878429,2.6075387,2.1216855,1.7672107,1.4369504,1.2279162,1.05136,0.9606572,0.532808487
Mike can compare the SUVs from both salesmen to decide which SUV to buy to help him get to school while being the most economically smart.,2.6560519,2.5893514,2.4878414,2.3146517,1.8976176,1.3171473,1.1007342,1.0535637,1.0167053,0.9464163,0.92025113,-0.454148098
Mikes should buy the SUV from his girlfriend's uncle because it's guaranteed to be good quality.,2.6750793,2.605634,2.4999468,2.3196306,1.8883655,1.2831388,1.0451721,0.99783087,0.9639711,0.8979334,0.87458473,-0.757050871
"Mike should go for the cheaper price of the SUV because as a college student, there is not enough more to spend.",2.7893472,2.7196994,2.6137037,2.4328604,1.9928863,1.3439143,1.0283622,0.9298766,0.8725195,0.7978636,0.7698557,-0.757050871
Take the bus or a shuttle to class,1.3673508,1.39121,1.4275211,1.4894726,1.586851,2.0686631,3.0083919,3.2662537,3.269352,3.1110911,3.0205073,-0.167425983
"First Mike should see if there is another location nearby that he could park or see if there are any apartments available for the same price that is not on a steep hill. If not, Mike could go talk to his girlfriend's uncle and try to negotiate and match te price that the local car dealer is offering. IF that doesn't work, then he should either walk to a bus stop or buy a vehicle he can afford from the local car dealer.",3.3781736,3.3718045,3.3621106,3.345573,3.164016,2.704193,2.193712,1.6336517,1.2912017,1.0372125,0.89996254,1.122433375
"If he plans on going ahead and getting the more reliable car, he should see if he can have the uncle somehow match the price to that of the local car dealer.",2.7632782,2.6954656,2.592263,2.416185,1.9866327,1.3591712,1.0670183,0.9746926,0.9181344,0.8416924,0.81237686,-0.015974596
"Instead of buying a new car/SUV, put better traction tires on the sports car.",2.2082398,2.2237706,2.2474046,2.2877297,2.288792,2.4046218,2.7516308,2.654179,2.5017817,2.2944443,2.178632,0.725101679
Mike should just go for the cheaper car. If he can get the same SUV for cheaper then he should go for it. He needs to think about his money situation and not care so much about when his girlfriends uncle with think.,3.046335,2.9522426,2.8090465,2.5647342,1.9920738,1.0901135,0.52367395,0.3840172,0.3349694,0.29125014,0.28454846,-0.757050871
Mike should check out all available vehicles to determine which place he will go to buy an SUV.,2.5861168,2.5077448,2.3884714,2.1849754,1.7176533,1.0879297,0.88143164,0.90187746,0.9094769,0.8692051,0.86152184,-0.318877369
"Mike can sell his car and come up with a budget on how much of a car he can afford. If he can afford it, he should get the car from his girlfriend's uncle because cheaper cars aren't always better quality-although if he cannot afford it then he should eiter save his money and his girlfriend can keep driving him until he has enough, or just buy the cheaper car because that is what he can afford.",3.2499332,3.1716335,3.0524714,2.8491645,2.3371525,1.4613602,0.80813044,0.52761585,0.39551485,0.30255616,0.26614815,0.923767527
Talk to his girlfriend's uncle and see if there could be some kind of deal he could make with him so that he won't be tight on money.,1.7146266,1.6307985,1.5032233,1.2855633,0.8516377,0.51042104,0.8733438,1.3054051,1.5100751,1.5502169,1.5873466,-0.302696712
"Mike should talk to his girlfriend's uncle about lowering the price, if not he should look elsewhere and have it checked out before he buys it.",2.4418256,2.3462372,2.2007632,1.9525666,1.4138563,0.72676367,0.56258816,0.7014058,0.7832251,0.7904852,0.8118371,-0.454148098
"I would definitely look carefully at his income and see what he is earning will allow him to buy from my uncle, and if he doesn't have enough money I would support him on his decision whether or not it means buying from my uncle. If he decided to I'd coul certainly assist him financially if needed. I would not force him either into selling his original car since it has sentimental value.",2.6062105,2.612522,2.6221256,2.638513,2.569111,2.4777174,2.5274029,2.2780344,2.0655003,1.846006,1.7252463,0.334142639
"Mike could tell his girlfriend that while he appreciates her help with wanting to find him a new SUV, he does not have the money right now and actually enjoys his care.  He would be okay with finding alternative forms of transportation so his girlfriend desn't become bothered.",3.158594,3.1022232,3.016435,2.8700678,2.4676476,1.7671157,1.2452297,0.93858325,0.76976776,0.6380389,0.5765128,-0.318877369
Explore all options and make a pros and cons list. Weigh your options and go from there.,0.75098944,0.7004922,0.6236425,0.49252567,0.2811255,0.51261735,1.6305366,2.396551,2.7187703,2.76526,2.7997835,-0.318877369
"If Mike is determined to keep his car, he needs to find another apartment that is not on a hill.",2.6792488,2.6701164,2.656218,2.6325054,2.4853344,2.2672808,2.2186015,1.9836892,1.7951785,1.602298,1.4988514,-0.015974596
