"FIrst, I would see if getting winter tires would help the sports car get up the hill. By doing this, some research will be done. If getting winter tires is not the best route, Mike will need to check the quality of all of the SUVs. The girlfriend's uncle ay have the best quality, but he won't know unless he finds out. If it turns out the vehicles are similar in quanity, Mike will need to talk to his girlfriend's uncle and tell him he has found the same vehicles for a lower price. The uncle should be undertanding since he is a student with small income. It is in the better interest for Mike to get a good quality, cheap vehicle that has good traction to get up the hill.",3.5831668,3.6423793,3.7324939,3.8862414,4.0,3.8867264,3.4470954,2.5922582,2.039517,1.6317376,1.3987479,1.273884762
Mike could walk to the bus stop.,1.4941516,1.4683791,1.4291565,1.3622383,1.2170011,1.3318398,2.0281165,2.3813305,2.4843194,2.4201322,2.389844,-0.015974596
"Mike should purchase the SUV from his girlfriend's uncle because that will ensure the quality of the vehicle so he most likely won't run into a money pit situation. Also, by taking this course of action, Mike's girlfriend and her uncle are pleased and he as an SUV; which solves his problem driving in the snow.",3.6569996,3.6360753,3.60423,3.5498989,3.2807984,2.6236126,1.8790311,1.2374622,0.8735218,0.6279971,0.4980092,-0.25548225
"Mike should buy an SUV from the dealer, because you never mix family and business, and work to slowly pay off the car.",2.8613698,2.793362,2.6898625,2.513279,2.0761533,1.4110041,1.0521824,0.91601884,0.8393412,0.75554526,0.7222575,-0.015974596
"Since he has had this car for six years, and is a student with a low income, to keep both my girlfriend and I happy, I will sell my car and buy a more reasonable and appropriate vehicle that would work for all the season changes.",2.7482054,2.7439485,2.7374701,2.7264168,2.597555,2.3853142,2.305733,2.0245688,1.8091357,1.6005712,1.4876909,-0.605599485
I would go and talk to the Uncle and have him look at the other dealer's cars without me to inspect the quality of them. And if they are of lower quality I would buy from the Uncle because he will back my purchase from him. However if they are better carsfor cheaper money than I would explain to the uncle that I'm a broke college kid and this is only a winter car and the price point is more important that the family loyalty. If he truly cars about me as a person (and if my girlfriend really loves me) theywill understand my dilemma and my decision.,2.1591945,2.1164927,2.0515053,1.9406292,1.6704553,1.4291873,1.623756,1.727799,1.7341784,1.6528711,1.6163341,1.122433375
Get a loan,0.0,0.0,0.0,0.0,0.07763898,0.9135009,2.69791,3.648692,4.0,4.0,4.0,0.923767527
Buy the SUV from his girlfriend's uncle and ask him for some type of payment arrangement,2.4795103,2.3911886,2.256774,2.0274458,1.5204425,0.8661907,0.69978493,0.79915845,0.8545297,0.84356415,0.85366184,-0.015974596
"As Mike is the one who is going to pay for this vehicle and drive it, he should do his own research into what kind of car and quality of car he is looking for. He should be free to make his own decision based on his own findings rather than feel the need o please his girlfriend or his girlfriend's uncle.",3.173554,3.1109622,3.0157046,2.8531835,2.4204164,1.674228,1.122455,0.82818615,0.6720877,0.55222493,0.4982977,0.334142639
I would explain to my girlfriend that because of my financial situation I cannot buy the car from her uncle,2.1031468,2.0424473,1.9500709,1.7924635,1.4412322,1.104786,1.2797714,1.4646133,1.5286599,1.4895389,1.479267,-0.757050871
"Mike could talk to his gf's uncle and say that if he does not lower in price, he cannot get the SUV from him.  He then could get the SUV from the other dealer inspected to show it is also of quality",2.6059895,2.5247297,2.401063,2.1900706,1.7077867,1.0520753,0.8230007,0.84333193,0.8541151,0.81832737,0.81361264,-0.454148098
"I should talk to others about ride sharing. If this is not available, then I would discuss costs of the vehicle with my girlfriend's uncle. If he is unwilling to come down on costs, then I will have to purchase from the other dealership.",2.4832947,2.4570994,2.4172332,2.349215,2.1348827,1.8796299,1.908547,1.814941,1.7111197,1.5695384,1.4971527,0.135476791
"Mike should weigh the pros and cons of having to sell his car first, as well as decide which dealer has the better vehicle to buy with not having to have as much maintenance work, because the cost of needing it could be expensive.  After figuring those stps out, he should discuss his plans and decisions with his girlfriend to obtain her input and make sure that she would be ok with his decision.",3.0099294,2.9375436,2.8273814,2.6394289,2.171582,1.4230409,0.95024633,0.76025677,0.6635193,0.5771504,0.54325694,0.334142639
"Mike should first evaluate his car and financial situation. It seems that he does not have a reliable vehicle to get him to school or work during the winter. If he decides that the sentimental value of his dream car is not worth risking his life or interrpting his and his girlfriend's life to find a ride, he should sell it or trade it in for a new vehicle. Then, he should discuss with his girlfriend that this is a big decision to make and that he needs to consider all aspects of her uncle's vehicles and te other dealership's. Mike should then take a friend or family member who has a decent understanding  about cars, so that they can help him compare which cars are worth putting his money and life towards.",3.7150476,3.7491326,3.8010044,3.8895066,3.8758395,3.551634,2.9431713,2.105948,1.5895563,1.2240491,1.0186676,0.684259873
